{
  "blockers": [],
  "created_at": "2026-08-23T06:52:03.704463+00:00",
  "delivery": {
    "head_sha": null,
    "pr_number": null,
    "pr_url": null
  },
  "implementation": {
    "branch": null,
    "candidate_sha": null,
    "changed_files": []
  },
  "lifecycle": {
    "current_state": "IMPLEMENTING",
    "previous_state": "CLASSIFIED",
    "resume_state": null
  },
  "reason": "STATE_TRANSITION",
  "resume_hint": null,
  "review": {
    "approval_valid": false,
    "current_target_sha": null,
    "current_verdict": null,
    "max_rounds": 5,
    "round": 0
  },
  "schema_version": "2.0.0",
  "task_id": "T-20260823-001-chrome-image-downloader-extension",
  "verification": {
    "candidate_sha": null,
    "evidence_ledger_path": ".ai/tasks/T-20260823-001-chrome-image-downloader-extension/verification.jsonl",
    "overall_status": "NOT_RUN"
  }
}
