{
  "blockers": [],
  "created_at": "2026-08-23T11:20:48.911648+00:00",
  "delivery": {
    "head_sha": "90ee10e3c85af07879663dc7a8be6ac022f61142",
    "pr_number": 1,
    "pr_url": "https://github.com/BinLate/download-images/pull/1"
  },
  "implementation": {
    "branch": null,
    "candidate_sha": "90ee10e3c85af07879663dc7a8be6ac022f61142",
    "changed_files": []
  },
  "lifecycle": {
    "current_state": "REVIEWING",
    "previous_state": "PR_PREPARING",
    "resume_state": null
  },
  "reason": "STATE_TRANSITION",
  "resume_hint": null,
  "review": {
    "approval_valid": false,
    "current_target_sha": "90ee10e3c85af07879663dc7a8be6ac022f61142",
    "current_verdict": null,
    "max_rounds": 5,
    "round": 1
  },
  "schema_version": "2.0.0",
  "task_id": "T-20260823-002-add-zip-download-and-format-conversion",
  "verification": {
    "candidate_sha": "90ee10e3c85af07879663dc7a8be6ac022f61142",
    "evidence_ledger_path": ".ai/tasks/T-20260823-002-add-zip-download-and-format-conversion/verification.jsonl",
    "overall_status": "PASS"
  }
}
